start,end,text,url
890.2,921.04," avantage, c'est un très, très, très gros avantage que vous avez. Donc ça, c'est ce qu'on a mis en place, c'est les potes. Mais vous en souvenez, à l'époque, il avait donc été prévu, et nous ne l'avions pas mis en place, parce qu'on a eu plein d'autres priorités depuis. Mais il était prévu à l'époque, vous en souvenez que les mandats très miemment, le serré diffusable que sur un des deux sites majeurs que sont se logés et le bon coin. Non, pas les créants, pardon, les mandats essentiels.",https://youtu.be/BtJz5_m4vCg
921.04,952.52," Je te demande, je vous dis, le premium serait diffusé lui sur tout les supports de diffusion, le mandat essentiel, le pas premium, donc lui ne serait diffusé que sur l'un de ces deux supports majeurs, et c'est vous qui choisiriez. Vous diriez, je le mets à tel endroit, ou je le mets à tel autre endroit. Nous l'avions pas mis en place, cette différenciation. On a mis en place les doubles tarifications tout de suite, parce que ça, c'est vraiment ce dont vous avez besoin, à ce moment-là.",https://youtu.be/BtJz5_m4vCg
952.52,984.52," La diffusion différenciée, celui de le bon coin, n'avait pas mis en place, parce que bien d'autres priorités, bien d'autres choses à faire, ce n'était pas un entretel du jour. Là, la mets en place, mais on a changé. On a changé les règles, vous allez comprendre pourquoi en fait. Vous simplement, parce que, je pense que vous le conchirrez tous ici dans le chat, ou ailleurs, mises à part ceux d'entre vous qui sont vraiment régions parisienne parisienne,",https://youtu.be/BtJz5_m4vCg
984.52,1019.68," se logées, ben vous en avez pas grand-chose à faire. N'ombre d'entre vous, mon dit, je te montre régulièrement aux agents. Excusez-moi, je vais venir qui gorgez, parce que je parle beaucoup beaucoup. Je te montre régulièrement aux agents. Qu'est-ce qui vous apporte les appels ? Telle site, telle site, et vous souvenez, notamment, je vous en l'avais beaucoup parlé. Je vous avais beaucoup interrochés là-dessus lors des repas de fin d'année, de l'année dernière, c'est-à-dire fin 2002, début 2023, quand on n'avait pas de fait de séminaire, et que j'étais venue d'inien avec vous tous, un coût à Giorg, un coût avec son province,",https://youtu.be/BtJz5_m4vCg
1019.68,1052.0800000000002," un coût à Giorg, vous souvenez, je t'ai venu tous au voire. Et je vous avais tous demandé, fait ce qu'il se remet en train d'améliorer toujours nos diffusions. Qu'est-ce qui testit vous apporte ? Ce le bon coin, ce logé, ou est-ce que France, etc, etc. Et tous, mes appels, en région parisienne parisienne, tous me disaient, c'est le jus, oui, un petit peu, une fois de temps en temps, mais c'est pas ça qui compte. En Bretagne, par exemple, le souviens, vous m'avez dit, non, ce qui compte beaucoup pour nous, c'est où est ce France ? Ça compte beaucoup, et bien sûr, le mastodont, toujours, le bon coin.",https://youtu.be/BtJz5_m4vCg
1052.0800000000002,1082.32," Donc, un petit peu partout en France, vous me disiez, il y a un tel, il y a un tel, mais le bon coin. Ça peut être, il y a un petit peu, je vous dis, bêtige de logicie mot. Vous m'avez dit, surprise, d'ailleurs, plusieurs à plusieurs endroits, je vais vous dire le cigaro, le cigaro, vous allochez pas si vous me confirmez la sur le chat, le cigaro, vous apportez pas mal de contents, ça m'avait surpris que vous en apporte autant. Mais la plus tard d'entre vous, vous me disiez, voilà, le bon coin, éventuellement le cigaro, éventuellement je sais pas où est ce France ou le midi libre,",https://youtu.be/BtJz5_m4vCg
1082.32,1115.04," mais oui, voilà, véronique, me confirme, cigaro, quelquefois on est fait, Marjorie me dit, j'ai des contacts de temps en temps du cigaro, qu'à tient aussi, vous voyez, il me confirme le cigaro aussi, ça m'avait surpris, je sais pas qu'il était aussi présent, par contre, tous et toutes, vous me disiez, frérique aussi, tous et toutes vous me disiez, se legez de moins en moins, de moins en moins, de moins en moins, de moins en moins. C'est une éronique disse legez, m'envoie des recherches de mandat à l'allouche, alors ça, par contre, si vous voulez des recherches de fonds de mandat, enfin des fausses recherches de mandat et des faus acquirures avec se legez,",https://youtu.be/BtJz5_m4vCg
1115.04,1146.08," alors ça vous en aurait des brouhets entières, ça y a pas d'alles, mais ça en compte la boîte, mais les sains c'est rares et en ce cas, normalement je parle de vrais contacts qui arrivent, de vrais personnes, qui vous appellent aux membres, aux jours, je peux visiter. Ça, la plupart de te entre vous, bah voilà, Pierre me confie en soix-sort que Boncoin 14 s. Mariez, et là on n'est pas surpris, qui est en région parisienne, proche paris, me dis numéro 1, se legez. Ah bah voilà, si p'titement, et le bon coin numéro 3, par ce cas, Mariez est en région parisienne, à ces proches de Paris, d'ailleurs, d'alléter,",https://youtu.be/BtJz5_m4vCg
1146.08,1176.68," la guerre incolombes, si p'titement, là, c'est se legez, c'est comme Laurent, Laurent se legez, Christine se legez, euh, Isabelle Corine, la je parle de Corine Barrow, en ruée et ma maison, se legez, pas doute. Mais, des consorts de Paris, et même, je dis de Paris, puis consorts de Paris, de la proche dans lieu, parce que vous restiez en région parisienne, mais vous commencez à vous y éloigner de l'approche dans lieu,",https://youtu.be/BtJz5_m4vCg
1176.68,1206.72," vous savez, c'est très grand la région parisienne, il y a une partie très urbaine, et ensuite, une partie qui est beaucoup plus rural, qu'on vous aille dans le sud des Isvlins, qu'on vous aille dans le sud de les Somme, qu'on vous aille dans l'est du, du, du, du, du 67, bah là, là, se legez n'existe plus, hein, et pourtant, vous direz, bah, on y en est de France, on est dans le sud des Isvlins, on est, je sais pas où, euh, à Guyon Cour, euh, on est à Malavallée, euh, c'est tout ça, ça se fait les Isvlins, c'est tout ça de ça, c'est la région parisienne, c'est les deux France, oui,",https://youtu.be/BtJz5_m4vCg
1206.72,1236.8," mais on est trop loin de Paris, pour que se legez n'est la moindre prise en ces secteurs, se legez n'a de véritable prise entrée, que est uniquement en région parisienne, et on proche dans l'uuse, pour ça, je vous disais, Marie, ça va proche de Paris, elle est à la Guerre-Colombes, il y a eu zah, alors, ce n'est pas, toute la région parisienne très bien, mais si on prend l'exemple de, de, de, des Isvlins, c'est-à-dire de, de l'ouest de Paris, euh, Marie est dans l'ouest, mais pas dans les Isvlins, elle est dans les Itsels, mais les Isvlins et les Itsels,",https://youtu.be/BtJz5_m4vCg
1236.8,1268.44," c'est juste l'un après l'autre, euh, imaginons vous aviez jusqu'à maison la fil, ça a germinant les poissies, si vous allez vers l'ouest, vous allez vous montrer, excusez-moi, vous allez vous montrer, c'est important qu'on comprenne la place de s'ology, parce que c'est un petit peu, tout ce dont on va parler ce soir, euh, si je regarde paris, donc sur Google, ou tu faisais-moi, Marie, hop, tout, reçusé, et qu'on va regarder une carte de Paris, 4 et nous dit s'ology pour la boucle de scène, oui, c'est pas mal de le voir comme ça,",https://youtu.be/BtJz5_m4vCg
1268.44,1299.24," euh, alors attendez, donc oui, pourquoi j'ai pas toute la carte, là, j'aurais voulu avoir maps vraiment, carte, voilà. Je t'en sais bien compliqué, c'est l'ongé en ce moment sur les cartes, voilà, donc nous voici à Paris, ça c'est une carte, moi je vais mettre une vue satellites, parce que je sais pas pourquoi c'est plus... euh, ben il est où m'a vu satellites, je sais pas, bon, tant pis. Je préfère la vue satellites, pour moi c'est plus clair, je sais pas, ah, elle est la voilà à la rire. Euh, c'est plus...",https://youtu.be/BtJz5_m4vCg
1299.24,1331.24," je me retrouve mieux sur une vue satellites, je sais que c'est pas le cas de tout le monde, et des gens qui les en ont une carte, moi je préfère, c'est plus clair, mais... C'est moins fouillis, vraiment je préfère la... la vue satellites, donc, voici Paris, au milieu, avec la scène, effectivement, donc, on parlait, il y a un instant quatrième, et qui a tout à fait raison, la scène qui remonte, pouce, pouce, pouce, pouce comme ça, euh, la scène qui... mais devrait pas s'appeler la scène d'ailleurs, ça devrait s'appeler, Yonne. Et bon, on l'appelle la scène, certains disent... bon, c'est très incertain, certains disent que ça vient de la DS,",https://youtu.be/BtJz5_m4vCg
1331.24,1362.44," euh, CNEQA, qui était une DS, euh, venurée par les... les gaulois, euh, c'est peut-être vrai, c'est très sugi à caution, quand même cette histoire, euh, mais bon, peut-être que ça vient de la DS, DS de l'eau et de la fertilité, souvent, d'ailleurs, la fertilité, il y a la loi, c'est normal. C'est des quoi ? Est-ce que vraiment sur le qui est donné son nom à la scène, c'est possible, beaucoup d'historiens remettent cette... cette idée en question. Et vous n'êtes pas là pour discuter les histoires de Paris et de l'histoire ni de l'histoire de la scène, euh, bien, bien entendu.",https://youtu.be/BtJz5_m4vCg
1362.44,1393.12," euh, alors, surgarde l'ouest de Paris, enfin, l'ouest de la banlieue, l'ouest, euh, parce que c'est le que je... que je connais le mieux, euh, je ne suis pas sur mon malin, par les dures, que je connais assez mal. euh, voyez, ici, donc, on est... ce sont les limites de Paris, euh, les petits points là, les petits points rougés, rougé blancs, les limites de Paris, qui en casent sur le bois de boulogne et le bois de la scène, ça c'est la zone urbaine de Paris, ça c'est un bois et ça c'est un deuxième bois, ni traîner pas quand il fait nuit, il vous arrivera des malheurs,",https://youtu.be/BtJz5_m4vCg
1393.12,1423.36," euh, traîner pas à Paris tout pour des qui fait nuit, il vous arrivera des valeurs d'ailleurs, et peut-être même, peut-être même le jour. Euh, et quand on va vers, vers moi, c'est alors non-terre, c'est là que nous avons le siège de la luque-in, que vous connaissez pour la plupart d'entre vous, euh, quand on va un petit peu, un petit peu vers, vers l'ouest, on voyait la Guerrine Colombe, c'est là que se trouve, euh, Marie, on voyait la Guerrine Colombe, on met très très près de Paris, quand il y a la circulation, ça m'est longtemps, mais imaginez-nous que vous soyez, je sais pas un moto et que vous puissiez vous rire de la circulation, vous avez, allez, 10 minutes",https://youtu.be/BtJz5_m4vCg
1423.36,1454.88," entre la porte champérée et la Guerrine Colombe, peut-être un quart d'heure maximum, euh, si vous avez beaucoup de feu, donc voyez, c'est vraiment juste à côté. Ensuite, vous continuez, euh, Catherine, vous parlez de la boucle de scène, c'est s'arbouillice, c'est de l'oubli, ici. La scène, ça c'est le tracé actuel de la scène, petit tracé actuel, parce qu'il n'a pas mal bougé au cours de l'histoire, notamment dans Paris, on va entrer très simple au milieu, mais la scène avait des meyants, et qu'elle est jusqu'à la guerre Saint-Lazar, par là, au par avant, c'est la raison pour laquelle c'était très maréca, je le prends en très longtemps. Donc la boucle de scène, c'est ici, jusqu'à où ils besoin, ça a trouvé l'esthéra,",https://youtu.be/BtJz5_m4vCg
1454.88,1486.16," voyez, ici, c'est maison la fitte, ce dont je vous parlez tout à l'heure. Mais on la fitte, Marie-Marlie, le port-Marlie, Marie-le-roi, je cherchais, donc Saint-Germain-Olé, carrière-soup-voici, déjà, chambourci, ça commence à être un peu rural. Ça commence à être un chambourci en redrogeval, pour commencer à avoir des champs, des champs, de maréchages, des cultures, etc. Donc voyez, on arrive juste ici, là, on a encore, mais on la fitte, sans aucun doute, se logé, c'est... Émajoritaire, l'orant est juste avant. Il est ici,",https://youtu.be/BtJz5_m4vCg
1486.16,1517.76," là où il y a écrit le cas, que je ne sais pas si voyais le petit match à l'avers. Ça, c'est du côté de Montesson. Le rang habite, il travaille juste exactement dans ce secteur-là, château, voilà, ici, se logé, oui. Des comptes est passent, là, on va dire, carrière-soup-voici, à chère, c'est fini, là. Se logé n'existe quasiment plus. Qu'as-y, mon plus, c'est le bon coin. C'est le bon coin, c'est indisputable, absolument indisputable. Et je pense que ceux d'entre vous, qui connaissent un petit peu le reste du contour de Paris,",https://youtu.be/BtJz5_m4vCg
1517.76,1551.0," vous me direz exactement la même chose. Je pense que dès qu'on arrive, ici, qu'on dépasse du côté de Noisi, le grand, à l'est, on doit arriver à peu près à la même chose. Voyez, si je viens de Montreuil, ici, sans aucun doute, Montreuil, on se logé, domine. Noisi, le grand, à mon avis, c'est déjà pu la même chose, un loign. Moi, je suis déjà allé à loignes, ici, parce que j'avais offert un bâtaine de l'air, un mes deux neufs, en avion et un petit taillet-rot-rôme. C'est les champs d'un ballon. Je pense que vous vient très bien. C'est les champs, les cultures, des céréales. C'est plus du tout la ville.",https://youtu.be/BtJz5_m4vCg
1551.0,1581.96," Et je pense que, au-delà d'Ori, ici, c'est pareil au sud. J'ai visé sur Orch, ça vinait sur Orch, tout ça. Ça doit être le bon coin, qui est aucun doute. Je pense qu'on peut faire la même chose partout autour de Paris. J'ai remit que nous dit, oui, c'est exact. J'ai eu de dire, non, c'est le débit de Lyon, qui est supérieur à celui de la scène. Oui, c'est vrai. C'est vrai. On dit la scène, mais en fait, la scène devrait s'appeler Lyon, parce que c'est désormais plus source de diva, si vous pouvez s'émonter, c'est Lyon qui apporte un plus grand débit à ce cours d'eau. Et donc, normalement, un cours d'eau",https://youtu.be/BtJz5_m4vCg
1581.96,1612.56," prend le nom de son assuiant le plus important. Donc, ça devrait être Lyon, mais bon, ça s'appelle la scène, lui piscit comme ça. Ah bon, c'est quelque chose d'agence qui diffuse sur bien ici. Ah oui, mais bien ici, il ne veulent pas douffre. On est passés bien pour eux. Bien ici, ne veux pas de nous, parce qu'on est des méchants d'agents-mands d'apparets. Alors, un coin qui est ce qui vole, mais qui ne vole plus. Mais peut-être, mais ça dépend. Mais si on paye, oui, même si vous payez au vu pu, c'est les vrais connards. Ça, bien ici, ils ont été créés bien ici. Vous savez, à l'origine, en partie,",https://youtu.be/BtJz5_m4vCg
1612.56,1643.84," pour détruire ce legez et pour détruire les agents-mands d'apparets. C'est un site qui est émonté par Santulie 21, la Forêt, la Fnaim, etc. Avec un double jettif, premièrement, créer un site qui détroude ce legez et éventuellement le bon rang, c'est-à-dire qu'il devient le premier site de diffusion vraiment désagent immobilier. Et l'autosie a but, c'était de cuire les agences, les réseaux d'agents-mands d'apparets, à l'époque où ces gens-là avaient juré notre perte, pour qu'ils se passaient autre chose, maintenant ils ont vécu les arrivais. Ils ont tenté un nombre de choses",https://youtu.be/BtJz5_m4vCg
1643.84,1673.84," que vous n'imaginez pas. Si je vous raconte tout ça, je vous dirais vous useré, mais c'est également trop non-sais incroyable. En plus, en plus, en plus encore. Donc, ils voulaient par ce biais également créer un site mastodonte de diffusion d'annonce immobilier, mais uniquement pour les vrais. Les agences, pas pour ces cobois, ces abecs, ces escroles d'agents-mands d'ataires, disait-il ? Si la raison pour laquelle ce site était fermée aux agents-mands d'ataires, ils ont eu un gros problème,",https://youtu.be/BtJz5_m4vCg
1673.84,1705.4," parce que propriété privée qui était membre de la faim avait donc droit à ce site. Alors là, ils ont été coincés. Donc, ils se prouffaient, ils ont essayé de virer, propriété privée, mais ils ont pari, ça a été une... C'est Dallas. Au-delà de Game of Thrones, c'était en même temps Dallas. À... C'est un cique de plus picant. Et ça va bien ? Donc, bien ici, c'est ainsi sur lequel on a jamais réussi à faire valoir nos droits, on a jamais réussi à ouvrir leur porte.",https://youtu.be/BtJz5_m4vCg
1705.4,1736.68," Donc, on n'y sera pas, en tout cas, pas tout de suite. Corine nous dit dans mon secteur à tour, parce que la sécurité est nouveau. Les demandes visites viennent pour moitié le bon coin. En viseront 30% sur le gilet, le reste des comptes à l'huile figaro immobilier est paru vendu. Oui. Normalement, quand vous êtes en province, c'est ce logicie qui donne une énie de manière écrasante. Et ensuite, vous avez un panache qui diffère que vous suyez dans un endroit ou un autre. En deuxième, vous pouvez avoir le figaro,",https://youtu.be/BtJz5_m4vCg
1736.68,1766.9199999999998," si vous êtes aujourd'hui une bêtise j'invente. Je ne sais pas, un arcachon. Bah, d'ailleurs, nous avons baissira, qui est avec nous, qui vient dans ce secteur-là, du côté d'art-achand. Vous êtes un arcachon, peut-être, j'en veux, je ne sais pas si c'est vraiment ça. C'est peut-être le figaro qui est en deuxième, et puis le gilet qui m'ont en troisième, par contre, si vous allez à 200 km de là, je sais pas, vous rapprochez tous, on vous dira à nono, chez moi, c'est le bon coin, bien sûr. Mais en deuxième, c'est pas le figaro. En deuxième, chez moi, c'est plutôt par le rendez-vous.",https://youtu.be/BtJz5_m4vCg
1766.9199999999998,1798.08," Vous voyez, le premier, c'est le bon coin, indisputable. Et après, selon les secteurs, deuxième, troisième, quatrième, ça diffère. A Paris, c'est premier, enfin, Paris est proche bon lieu. Première, se leger, deuxième, le bon coin. Et en troisième, ça peut être le stérot, ça peut être la rue vendue, ça peut être qui sèche. Ça, vous faudrait plutôt en discuter avec Laurent, avec Christian, etc. Enfin, des gens qui, comme vous avez de Mariez, qui connaissent bien leur secteur. Comme vous disiez, Mariez, juste aussi. Mariez, disait, trois, le bon coin. C'est ça. Mariez, disait, premier, se leger,",https://youtu.be/BtJz5_m4vCg
1798.08,1828.32," deuxième, le figaro, trois, le bon coin. Je suis surpris que le bon coin, ce soit pas en deuxième, d'ailleurs, Mariez. Je suis assez surpris. Peut-être parce que le figaro est très costaud, chisent. Bon. Ça m'avait surpris que le figaro soit aussi présent. Je pensais vraiment que c'était un mineur, et vous m'avez détrupé. Alors, je vous disais, l'évolution du marché ces dernières années, ça a été une progression toujours plus roulant compresseur de le bon coin sur ce loger.",https://youtu.be/BtJz5_m4vCg
1828.32,1859.32," Ah, c'est pour ça qu'on a fait très très attention qu'est-ce qu'on fait avec ce loger? Est-ce que, pour les mandais essentiels, je parle des mandais essentiels, bien sûr. Qu'est-ce qu'on fait pour ce loger avec les mandais essentiels? Est-ce qu'on met un coulin, un coulote, ou est-ce qu'on met le paquet sur le bon coin? Pourquoi je dis, on met un coulin, un coulote? Parce que vous en souvenez, il y a, lorsqu'on a mis ces doubles tarifications, on avait defini la chose suivante. On avait dit les mandais essentiels,",https://youtu.be/BtJz5_m4vCg
1859.36,1891.0," vous pourrez les mettre quand vous voulez, un coul sur le bon coin, un coul sur ce loger, si vous voulez quand même donner une petite chance à ce loger, même si ils sont pas majoritaires dans vos secteurs, il peut avoir quand même une importance, il peut être intéressant. Et donc, on avait créé une interface que je vais vous montrer, une interface qui vous permettait d'aller cocher la diffusion, soit vous la mettez sur le bon coin,",https://youtu.be/BtJz5_m4vCg
1891.0,1925.16," soit vous la mettez sur ce loger pour les mandats essentiels, en disant que je peux plus de puissants de ces deux supports à la fois. Donc, ce que je pourrais faire, c'est aller le lundi mardi, le mettre sur le bon coin, le mercredi, je dis, le mettre sur ce loger. Et où vous avez donc créé une interface, alors même si on avait pas mis en place cette diffusion différenciée, parce qu'en fait, vous étiez discusé et dans le bon coin et dans ce loger de manière indiscriminée,",https://youtu.be/BtJz5_m4vCg
1925.16,1961.52," et il fallait bien qu'on le mette en place un jour. Et là, vu l'évolution de la position des différenciates, il était plus que le temps de le faire, mais ce loger nous en empêche de le faire. Alors, si je vais chercher la diffusion, à ce sort d'infusion automatique, donc, voyez, regardez, voyez sur l'identité, vous aviez la possibilité d'en vos infos, il suit dans mes infos, de dire, je vais me mettre en automatique ou en manuel.",https://youtu.be/BtJz5_m4vCg
1961.52,1992.28," Si vous êtes en automatique, vos mandats sont discusés automatiquement, vous ne vous posez pas de question. Si vous cochez par contre le petit bouton manuel, vous allez valider, et après avoir valider, il faut se déconnecter, se reconnecter, pour ce soit bien pris en compte. C'est une petite mesure de sécurité, tout simplement. Donc, on se reconnecte. Et une fois que vous avez fait cette petite malépudation, vous voyez apparaître un nouveau lien qui s'appelle Diffusion Anon, ce qui est là. Vous voyez, il n'y a été pas, il y a un instant lorsque j'étais en automatique.",https://youtu.be/BtJz5_m4vCg
1992.28,2022.36," Et lorsque vous allez sur Diffusion des Anons, vous avez cette interface alors, il n'y a pas de mangarde ici sur cet agent, parce que c'est un agent de test, il n'y a pas de mandat sur cet agent, donc vous ne voulez pas. Je t'ai peut-être allé sur un mandat sur lequel il y a des agents. L'un d'entre vous peut-il me dire si il est en manuel? Est-ce qu'on a un parmi vous qui est en manuel? Et je me connecte directement sur les identités de cet agent. Parce que je n'ai pas un de tête qui est en manuel. Frédéric est en manuel? Ah bah super. Je vais aller chez Frédéric.",https://youtu.be/BtJz5_m4vCg
2022.36,2052.92," Alors, je vais tout de suite. Parce que j'ai la possibilité de me connecter à vos identités, vous les savez, pour aller voir ce qui marche et ce qui marche pas. Alors l'autre jour, il y a eu un agent. J'étais au téléphone avec un agent, il n'est pas dire qui, il n'est pas là ce soir. Et je suis dit, attendez, je viens les voir dans votre e-mail. Je suis dit, je vais voir dans votre e-mail. Pendant ce soir, je vais vous connecter à l'églantine de Frédéric.",https://youtu.be/BtJz5_m4vCg
2055.12,2085.56," Donc, je dis à l'agent, attendez, je me connectère votre e-mail. Il est bien bon, pouvez-vous connecter à mon e-mail? Qui est à la, oui oui, bien sûr, c'est normal. Il a... super inquiét... super inquiét, mais quand vous dis inquiét, c'est quoi de plus profite? Et vous pouvez aller sur ma boîte mail aussi? Jusqu'à nos, la boîte mail, c'est pas nos, qu'il a faisons, c'est un prestateur extérieur. C'est pas nos, on n'a pas accès à votre e-mail. On a accès à votre églantine, parce que sinon, qui créons églantine, et puis parce que dedans, il n'y a pas d'informations considénciels,",https://youtu.be/BtJz5_m4vCg
2085.56,2115.76," mais la boîte mail, non, pour tout à... Et là, je crois qu'il y avait une flacque de soeur en dessous de lui. Oh, ça a un d'accord, non, non, mais pour sécurité, bien sûr, je... Je sais pas ce qu'il a sur sa boîte mail lui, mais il n'a pas envie qu'on l'voie. Ha, ha, ha, ha, visiblement, il y a des trucs pas très... Peut-être pas pour les enfants, je sais pas. Ah, mais le pour... Il a eu la trouille, tout. Mais il ne trouille. Euh, alors... Donc, je peux aller sur votre églantine, bien sûr, mais rassurez-vous, aux amis,",https://youtu.be/BtJz5_m4vCg
2115.76,2150.08," personne n'accès à votre boîte mail, et c'est à nous qu'ils erront le... J'ai ron le serveur mail, bien entendu. Soyez rassuré si vous avez ce genre de qui étude. Le pauvre, mais j'ai senti un soulagement, mais un soulagement, je... Je sais pas ce qu'il a sur sa boîte mail lui, hein. Bon, je ne sais pas... Je ne sais pas genre, non. Ha, ha, ha, ha. Alors, je me connecte à la boîte mail de Frédéric. Ok.",https://youtu.be/BtJz5_m4vCg
2150.08,2183.64," Donc, hop, je vous affiche les glantines de Frédéric. Parce que la fête sur les glantines de Psyrbélia, voilà, vous êtes maintenant sur le glantine de Frédéric. Et si je vais dans le lien Frédéric de Narbonne, dans le lien, euh, d'ifugie dans des annonces, vous voyez, alors, attendez. Voilà. Si vous allez sur le lien d'ifusion des annonces, vous appez donc, euh...",https://youtu.be/BtJz5_m4vCg
2183.64,2214.96," Le... La liste des mandats en cours de Frédéric, et si la puissure modifiée, je vais rien modifier Frédéric, soit les frantiers. Si la puissure le lien modifiée, il peut changer l'état de ces différents mandats. Pour vous voyez, ici, Frédéric a diffié, de choisir de ne pas mettre ce mandat sur le glantine de Psyrbélia, mais de le mettre sur le glantine de Psyrbélia. Et d'ailleurs, je remarque, parce que le groupe 2, c'est se logé, le groupe 3, c'est le bon coin. Je remarque que Frédéric laisse toutes ces annonces sur le glantine.",https://youtu.be/BtJz5_m4vCg
